<?xml version="1.0" encoding="UTF-8"?>
<!DOCTYPE document SYSTEM "avis2.dtd" [<!ENTITY % HTMLsymbol SYSTEM "xhtml-symbol.ent"> %HTMLsymbol; ]>
<document>
<header>
<attribute name="file" value="FV-20190618-det-murres-i-brann-t.xml"/>
<attribute name="url" value="http://www.fvn.no/sport/i/opVRrj/Det-murres-i-Brann-troppen-Det-er-verken-overraskende-eller-farlig" frk="42 0 0 311 %%"/>
<attribute name="source" value="FV"/>
<attribute name="date" value="2019-06-18 11:59"/>
<attribute name="author" value=""/>
<attribute name="gender" value="U"/>
<attribute name="class1" value="sport"/>
<attribute name="class2" value="sport"/>
<attribute name="language" value="nob"/>
</header>
<body>
<div type="title" level="1">«Det murres i Brann-troppen. Det er verken overraskende eller farlig.»</div>
<div type="ingress">KOMMENTAR: Spørsmålet er hvordan murringen blir håndtert, skriver Anders Pamer.</div>
<div type="author"></div>
<div type="date"></div>
<div type="caption"><p>KRITISK: Gilbert Koomson uttalte seg kritisk om trener Lars Arne Nilsen etter kampen mot Haugesund. FOTO: MARIUS SIMENSEN / BILDBYRÅN NORWAY</p></div>
</body></document>
