<?xml version="1.0" encoding="UTF-8"?>
<!DOCTYPE document SYSTEM "avis2.dtd" [<!ENTITY % HTMLsymbol SYSTEM "xhtml-symbol.ent"> %HTMLsymbol; ]>
<document>
<header>
<attribute name="file" value="SA-20190903-tog-med-sovekup-er-o.xml"/>
<attribute name="url" value="http://www.aftenbladet.no/forbruker/i/70QrVW/Tog-med-sovekup-er-opptil-dobbelt-sa-dyrt-som-en-flytur--pa-samme-strekning" frk="51 0 0 303 %%"/>
<attribute name="source" value="SA"/>
<attribute name="date" value="2019-09-03 14:33"/>
<attribute name="author" value=""/>
<attribute name="gender" value="U"/>
<attribute name="class1" value="forbruker"/>
<attribute name="class2" value=""/>
<attribute name="language" value="nob"/>
</header>
<body>
<div type="title" level="1">Tog med sovekupé er opptil dobbelt så dyrt som en flytur – på samme strekning</div>
<div type="ingress">Vi har sammenlignet prisene mellom Norwegian, SAS og Vy. Tog er både billigst og dyrest.</div>
<div type="author"></div>
<div type="date"></div>
<div type="caption"><p>Å reise med sovekupé i Norge er dyrere enn å fly. Collage: Gorm Kallestad, Berit Roald, Ole Berg-Rusten/ NTB scanpix</p></div>
</body></document>
