<?xml version="1.0" encoding="UTF-8"?>
<!DOCTYPE document SYSTEM "avis2.dtd" [<!ENTITY % HTMLsymbol SYSTEM "xhtml-symbol.ent"> %HTMLsymbol; ]>
<document>
<header>
<attribute name="file" value="DA-20190312-tolldirektoratet-far.xml"/>
<attribute name="url" value="http://www.dagsavisen.no/innenriks/tolldirektoratet-far-900-000-kroner-i-gebyr-fra-datatilsynet-for-ulovlig-overvaking-av-biler-1.1292393" frk="242 15 26 1660"/>
<attribute name="source" value="DA"/>
<attribute name="date" value="2019-03-12 20:46"/>
<attribute name="author" value="NTB"/>
<attribute name="gender" value="U"/>
<attribute name="class1" value="innenriks"/>
<attribute name="class2" value=""/>
<attribute name="language" value="nob"/>
</header>
<body>
<div type="title" level="1">Tolldirektoratet får 900.000 kroner i gebyr fra Datatilsynet for ulovlig overvåking av biler</div>
<div type="ingress">Tolldirektoratet må betale 900.000 kroner i overtredelsesgebyr etter å ha drevet ulovlig overvåking av flere millioner biler, slår Datatilsynet fast.</div>
<div type="author"></div>
<div type="date"></div>
<div type="caption"><p>Bjørn Erik Thon er direktør i Datatilsynet.</p></div>
<div type="text">
<p>NRK kunne i midten av februar fortelle at 80 millioner bilpasseringer er blitt videoovervåket uten hjemmel i loven. Nå har Datatilsynet konkludert i saken, etter å ha gransket den i flere måneder. Overvåkingen var ulovlig, slår Datatilsynet fast.</p>
<p>– Dette er det største overtredelsesgebyret vi noensinne har varslet, sier direktør Bjørn Erik Thon til .</p>
<p>Gebyret er fastsatt etter den gamle personvernloven som nå har blitt erstattet.</p>
<p>– Hadde vi vurdert lovbruddene opp mot den nye loven, hadde gebyret trolig blitt langt høyere, sier Thon.</p>
<p>Følg Dagsavisen på Facebook og Twitter!</p>
<p>Datatilsynet advarte allerede i mars 2017 om at Tolldirektoratets overvåking var inngripende for personvernet, og manglet hjemmel. I begynnelsen av 2018 varslet også Tolldirektoratets egne jurister om at overvåkingen var ulovlig.</p>
<p>mener etaten har brutt personopplysningsloven gjennom innsamling og bruk av opplysninger fra kameraer uten lov.</p>
<p>Datatilsynet sier de har lagt vekt på at Tolldirektoratet har overvåket 80 millioner passeringer, hvor antall berørte personer anslås til 7 – 8 millioner.</p>
<p>Tolletaten skal drive overvåking av grensekryssende trafikk, men de har også registrert og lagret data fra kameraer som Statens vegvesen har utplassert mange steder i landet. Dette er kameraer som Tolldirektoratet ikke skal ha tilgang til opplysninger fra, ifølge Datatilsynet.</p></div></body></document>
