<?xml version="1.0" encoding="UTF-8"?>
<!DOCTYPE document SYSTEM "avis2.dtd" [<!ENTITY % HTMLsymbol SYSTEM "xhtml-symbol.ent"> %HTMLsymbol; ]>
<document>
<header>
<attribute name="file" value="SA-20190624-venstre-stavanger-tr.xml"/>
<attribute name="url" value="https://www.aftenbladet.no/lokalt/i/kJdk39/Venstre---Stavanger-trenger-en-egen-byarkitekt" frk="73 0 0 471 %%"/>
<attribute name="source" value="SA"/>
<attribute name="date" value="2019-06-24 13:18"/>
<attribute name="author" value=""/>
<attribute name="gender" value="U"/>
<attribute name="class1" value="lokalt"/>
<attribute name="class2" value="henrik lundberg,christian wedler,jan erik søndeland,bystyret,arkitektur,byutvikling,bergen,alexandria algard"/>
<attribute name="language" value="nob"/>
</header>
<body>
<div type="title" level="1">Venstre: - Stavanger trenger en egen byarkitekt</div>
<div type="ingress">– Vi bør gjøre som i Bergen, og få på plass en egen byarkitekt. I dag er ansvaret for byens utseende for spredt og i for stor grad overlatt til tilfeldigheter, sier Jan Erik Søndeland (V).</div>
<div type="author"></div>
<div type="date"></div>
<div type="caption"><p>Jan Erik Søndeland, ordførerkandidat for Stavanger Venstre, vil opprette en egen byarkitektavdeling i Stavanger kommune. Bakgrunnen er blant annet den store utbyggingen i Paradis, som er i startgropa. Jarle Aasland</p></div>
</body></document>
