<?xml version="1.0" encoding="UTF-8"?>
<!DOCTYPE document SYSTEM "avis2.dtd" [<!ENTITY % HTMLsymbol SYSTEM "xhtml-symbol.ent"> %HTMLsymbol; ]>
<document>
<header>
<attribute name="file" value="DB-20191014-stjernetrio-sto-over.xml"/>
<attribute name="url" value="http://www.dagbladet.no/sport/stjernetrio-sto-over-siste-trening/71706464" frk="149 39 39 985"/>
<attribute name="source" value="DB"/>
<attribute name="date" value="2019-10-14 11:04"/>
<attribute name="author" value="NTB I"/>
<attribute name="gender" value="U"/>
<attribute name="class1" value="sport"/>
<attribute name="class2" value=""/>
<attribute name="language" value="nob"/>
</header>
<body>
<div type="title" level="1">Stjernetrio sto over siste trening</div>
<div type="ingress">Joshua King, Omar Elabdellaoui og Haitam Aleesami var ikke å se da de norske fotballherrene trente i Bucuresti mandag ettermiddag.</div>
<div type="author">NTB I</div>
<div type="date">2019-10-14</div>
<div type="caption"><p>STÅR OVER: Joshua King, her fra flyplassen i Bucure&#537;ti før EM-kvalifiseringskampen mot Romania. Foto: Stian Lysberg Solum / NTB Scanpix</p></div>
<div type="text">
<p>De tre spillerne, som alle spilte 90 minutter i 1-1-kampen mot Spania lørdag, trente alternativt på spillerhotellet.</p>
<p>Det får NTB opplyst fra landslagets medieansvarlige, Svein Graff.</p>
<p>Norge spiller bortekamp mot Romania tirsdag kveld. Kun seier er godt nok om håpet om direkte EM-plass skal leve videre.</p>
<p>EM-KVALIFISERING</p>
<p>Resterende kamper i Norges gruppe:</p>
<p>Tirsdag:</p>
<p>Sverige – Spania, Romania – Norge, Færøyene – Malta.</p>
<p>15. november:</p>
<p>Norge – Færøyene, Spania – Malta, Romania – Sverige.</p>
<p>18. november:</p>
<p>Sverige – Færøyene, Spania – Romania, Malta – Norge</p>
<p>Tabell</p>
<p>Spania 19 (18-4)</p>
<p>Sverige 14 (17-8)</p>
<p>Romania 13 (16-7)</p>
<p>Norge 10 (12-9)</p>
<p>Malta 3 (2-17)</p>
<p>Færøyene 0 (3-23)</p></div></body></document>
