<?xml version="1.0" encoding="UTF-8"?>
<!DOCTYPE document SYSTEM "avis2.dtd" [<!ENTITY % HTMLsymbol SYSTEM "xhtml-symbol.ent"> %HTMLsymbol; ]>
<document>
<header>
<attribute name="file" value="SA-20190718-stortalent-17-fra-st.xml"/>
<attribute name="url" value="http://www.aftenbladet.no/sport/i/naByzo/Stortalent-17-fra-Stavanger-rok-ut-av-EM-Om-to-uker-vil-hun-sla-tilbake" frk="81 41 18 439 %%"/>
<attribute name="source" value="SA"/>
<attribute name="date" value="2019-07-18 15:02"/>
<attribute name="author" value=""/>
<attribute name="gender" value="U"/>
<attribute name="class1" value="sport"/>
<attribute name="class2" value="stavanger,friidrett"/>
<attribute name="language" value="nob"/>
</header>
<body>
<div type="title" level="1">Stortalent (17) fra Stavanger røk ut av EM. Om to uker vil hun slå tilbake.</div>
<div type="ingress">Skjalgs Sara Busic (17) var litt skuffet over at hun ikke klarte å komme seg videre fra 800 meter under U20-EM i Boräs. Men hun var klar på å slå tilbake senere i sesongen.</div>
<div type="author"></div>
<div type="date"></div>
<div type="caption"><p>Sara Busic, til venstre, klarte ikke å ta seg videre fra forsøksheatet på 800 meter. Her sammen med Andrea Modin Engesæth, som skal løpe 1500 under EM U20 i Boräs. Privat</p></div>
</body></document>
