<?xml version="1.0" encoding="UTF-8"?>
<!DOCTYPE document SYSTEM "avis2.dtd" [<!ENTITY % HTMLsymbol SYSTEM "xhtml-symbol.ent"> %HTMLsymbol; ]>
<document>
<header>
<attribute name="file" value="AP-20191017-bamba-utestengt-dage.xml"/>
<attribute name="url" value="http://www.aftenposten.no/sport/fotball/i/4qGJPo/Bamba-utestengt-dager-etter-basketak-med-Berisha" frk="117 0 0 719"/>
<attribute name="source" value="AP"/>
<attribute name="date" value="2019-10-17 11:51"/>
<attribute name="author" value="Mads Bøyum"/>
<attribute name="gender" value="M"/>
<attribute name="class1" value="sport,fotball"/>
<attribute name="class2" value=""/>
<attribute name="language" value="nob"/>
</header>
<body>
<div type="title" level="1">Bamba utestengt dager etter basketak med Berisha</div>
<div type="ingress">Daouda Bamba får ikke være med Brann til kampen mot Sarpsborg søndag. Tidligere denne uken havnet han i krangel med spisskollega Veton Berisha.</div>
<div type="author">Mads Bøyum</div>
<div type="date">17.okt.2019 13:51</div>
<div type="caption"><p>FOTO: Jan Kåre Ness / NTB scanpix UTESTENGT: Daouda Bamba er utestengt fra Branns kamptropp mot Sarpsborg. Denne uken var han og Veton Berisha i konflikt på trening.</p></div>
<div type="text">
<p>Mandag oppsto det en konflikt på trening mellom Branns to stjerneangripere, Daouda Bamba og Veton Berisha.</p>
<p>Berisha skal ha snakket med Bamba om det som foregikk under forrige kamp mot Molde, da treneren vurderte Bamba som «ikke klar til å komme inn». Under treningen gikk Bamba så hardt til i en takling mot Berisha at det vakte reaksjoner.</p></div></body></document>
