<?xml version="1.0" encoding="UTF-8"?>
<!DOCTYPE document SYSTEM "avis2.dtd" [<!ENTITY % HTMLsymbol SYSTEM "xhtml-symbol.ent"> %HTMLsymbol; ]>
<document>
<header>
<attribute name="file" value="NL-20190816-her-er-de-mest-lonns.xml"/>
<attribute name="url" value="http://www.nord24.no/tromso/troms/okonomi-og-naringsliv/her-er-de-mest-lonnsomme-spisestedene-i-hele-fylket-linn-a-29-tjener-mest-penger-av-alle-i-bransjen/s/5-32-126754" frk="52 14 5 339"/>
<attribute name="source" value="NL"/>
<attribute name="date" value="2019-08-16 19:02"/>
<attribute name="author" value="Rune Endresen"/>
<attribute name="gender" value="M"/>
<attribute name="class1" value=""/>
<attribute name="class2" value=""/>
<attribute name="language" value="nob"/>
</header>
<body>
<div type="title" level="1">Her er de mest lønnsomme spisestedene i hele fylket: Linnèa (29) tjener mest penger av alle i bransjen</div>
<div type="ingress">Stor oversikt over 145 spisesteder i Troms med rangering av lønnsomhet, inntekter og overskudd. Noen nykommere kan vise frem eventyrlige overskudd, mens andre og velkjente aktører sliter tungt - og må tåle svære tap.</div>
<div type="author">Av Rune Endresen</div>
<div type="date">16. august 2019, kl. 19:02</div>
<div type="caption"></div>
</body></document>
