<?xml version="1.0" encoding="UTF-8"?>
<!DOCTYPE document SYSTEM "avis2.dtd" [<!ENTITY % HTMLsymbol SYSTEM "xhtml-symbol.ent"> %HTMLsymbol; ]>
<document>
<header>
<attribute name="file" value="FV-20190417-varsler-knallvar-pa-.xml"/>
<attribute name="url" value="http://www.fvn.no/nyheter/lokalt/i/zGl0r4/Meteorologene-om-Sorlandet-Sol_-bare-sol" frk="54 0 0 323 %%"/>
<attribute name="source" value="FV"/>
<attribute name="date" value="2019-04-17 18:46"/>
<attribute name="author" value=""/>
<attribute name="gender" value="U"/>
<attribute name="class1" value="nyheter,lokalt"/>
<attribute name="class2" value="nyheter,lokalt"/>
<attribute name="language" value="nob"/>
</header>
<body>
<div type="title" level="1">Varsler knallvær på Sørlandet ut påska</div>
<div type="ingress">Sola har for lengst meldt sin ankomst i Sør-Norge, og den har planer om å bli gjennom hele påska. Snart kommer også varmen, skal vi tro meteorologene.</div>
<div type="author"></div>
<div type="date"></div>
<div type="caption"><p>Sol så langt øyet kan se, på skitur på Hovden. Bildet er tatt ved en tidligere anledning. FOTO: Bjelland, Kjartan</p></div>
</body></document>
