<?xml version="1.0" encoding="UTF-8"?>
<!DOCTYPE document SYSTEM "avis2.dtd" [<!ENTITY % HTMLsymbol SYSTEM "xhtml-symbol.ent"> %HTMLsymbol; ]>
<document>
<header>
<attribute name="file" value="BT-20190709-sandviken-kapteinen-.xml"/>
<attribute name="url" value="https://www.bt.no/sport/i/JoL0Rb/Sandviken-kapteinen-enig-med-AC-Milan" frk="288 1 3 1704" ab="Nei"/>
<attribute name="source" value="BT"/>
<attribute name="date" value="2019-07-09 15:18"/>

<attribute name="author" value="NTB"/>
<attribute name="gender" value="m"/>
<attribute name="class1" value="sport"/>
<attribute name="class2" value="IL Sandviken,AC Milan"/>
<attribute name="language" value="nbo"/>
</header>
<body>
<div type="title" level="1">Sandviken-kapteinen enig med AC Milan</div>
<div type="ingress">Sandvikens kaptein Stine Hovland er enig med AC Milan om sine personlige betingelser for en overgang.</div>
<div type="author">NTB</div>
<div type="date">9. juli 2019 15:18</div>
<div type="caption"><p>TIL ITALIA: Sandviken-kaptein Stine Hovland var en del av den norske troppen i fotball-VM i Frankrike. FOTO: Bjørn Erik Larsen</p></div>
<div type="text">
<p>Dermed er det opp til klubbene å bli enige, skriver Bergensavisen.</p>
<p>Styreleder i Sandviken, Pål Hansen, sier derimot at Sandviken ikke har hørt noe fra den italienske storklubben.</p>
<p>– Vi ønsker gjerne å være åpen om ting som skjer i Sandviken, men akkurat her er det ingenting å melde. Vi har ikke mottatt bud fra dem eller noe andre klubber, sier Hansen til Bergens Tidende.</p>
<p>Milan gjorde nylig unna sin første sesong i den italienske toppdivisjonen. I likhet med flere storlag i Europa satser klubben også på damene.</p>
<p>28 år gamle Hovland har kontrakt med Sandviken ut året. Hun kan allerede nå signere for Milan fra 1. januar, uten at italienerne må betale overgangssum. AC Milans intensjon er at hun kan kjøpes fri allerede i sommer.</p>
<p>– Hun har vært en trofast spiller i seks år nå. Vi er alle innstilte på å gi Stine denne muligheten, men igjen, vi venter fortsatt på et bud fra AC Milan, sier Hansen.</p></div>
<div type="title" level="3"> – Agentstyrt</div>
<div type="text">
<p>Hansen sier at ingenting ligger i veien for at Hovland og AC Milan er enig om en personlig kontrakt.</p>
<p>– Det hele er agentstyrt. Det er en litt spesiell situasjon, for vi hørte om dette i påsken. Siden har vi ikke hørt noe. Vi må bare forholde oss til realiteten og den er at Stine Hovland er Sandviken-spiller, sier Hansen.</p>
<p>Styrelederen forventer at Sandviken vil være aktive på overgangsmarkedet i sommer.</p>
<p>Stine Hovland og agent Nils Christiansen har ikke besvart Bergens Tidendes gjentatte henvendelser.</p></div></body></document>
