<?xml version="1.0" encoding="UTF-8"?>
<!DOCTYPE document SYSTEM "avis2.dtd" [<!ENTITY % HTMLsymbol SYSTEM "xhtml-symbol.ent"> %HTMLsymbol; ]>
<document>
<header>
<attribute name="file" value="FV-20190809-slar-tilbake-etter-t.xml"/>
<attribute name="url" value="http://www.fvn.no/sport/i/dOjXmO/Slar-tilbake-etter-trenerprofilenes-friskmelding-av-norsk-fotball--Litt-tidlig-a-sla-seg-pa-brystet" frk="83 3 2 542 %%"/>
<attribute name="source" value="FV"/>
<attribute name="date" value="2019-08-09 15:37"/>
<attribute name="author" value="Viljam Brodahl"/>
<attribute name="gender" value="M"/>
<attribute name="class1" value="sport"/>
<attribute name="class2" value="sport"/>
<attribute name="language" value="nob"/>
</header>
<body>
<div type="title" level="1">Slår tilbake etter trenerprofilenes «friskmelding» av norsk fotball: – Litt tidlig å slå seg på brystet</div>
<div type="ingress">Lars Bohinen, Erling Moe og Jostein Grindhaug er lei det negative fokuset. Ekspert mener det fortsatt er en «lang vei å gå» for norsk fotball.</div>
<div type="author">Viljam Brodahl</div>
<div type="date">09.aug.2019 15:37</div>
<div type="caption"><p>Aalesund-trener Lars Bohinen mener kritikken mot norsk fotball er uberettiget. FOTO: Faksimile / Svein Ove Ekornesvåg / NTB scanpix Leif Welhaven, kommentator i VG. Rosenborg slo Maribor overbevisende 3 – 1 på bortebane onsdag kveld. Carl-Erik Torp er fotballekspert for NRK.</p></div>
</body></document>
