<?xml version="1.0" encoding="UTF-8"?>
<!DOCTYPE document SYSTEM "avis2.dtd" [<!ENTITY % HTMLsymbol SYSTEM "xhtml-symbol.ent"> %HTMLsymbol; ]>
<document>
<header>
<attribute name="file" value="SA-20191111-alle-har-noe-a-lare-.xml"/>
<attribute name="url" value="http://www.aftenbladet.no/sport/i/JoXyMj/alle-har-noe-a-lre-av-molde-rosenborg-ogsa" frk="718 0 2 4220"/>
<attribute name="source" value="SA"/>
<attribute name="date" value="2019-11-11 10:44:46"/>
<attribute name="author" value="Ola Bernhus"/>
<attribute name="gender" value="M"/>
<attribute name="class1" value="sport"/>
<attribute name="class2" value=""/>
<attribute name="language" value="nob"/>
</header>
<body>
<div type="title" level="1">«Alle har noe å lære av Molde, Rosenborg også»</div>
<div type="ingress">KOMMENTAR: Moldes gull var ikke bare fortjent. MFK viser også vei ut fra det som ligner en sportslig krise i norske klubber.</div>
<div type="author">Ola Bernhus</div>
<div type="date">2019-11-11 10:44:46</div>
<div type="caption"><p>Molde sikret seriegullet på hjemmebane søndag. Svein Ove Ekornesvåg, NTB scanpix</p> <p>Moldes trener, Erling Moe, ser utover folkehavet i Molde under feiringen av seriegullet søndag. Assistenttrener Trond Strande til høyre.</p> <p>Det ble fest i Molde søndag kveld.</p> <p>Bodø/Glimt har tilført noe til norsk fotball i år, mener vår kommentator. Søndag møtte de Rosenborg.</p> <p>Brann har ikke overbevist denne sesongen, mener Ola Bernhus.</p></div>
<div type="text">
<p>Idrettslig var det bare to verdige gullkandidater i Eliteserien i år. Heldigvis vant en av dem.</p>
<p>Moldes seriemesterskap var ikke bare fortjent, de er også trøsten – kall det gjerne redningen – i en sesong der altfor mange lag ikke har bidratt til en sportslig utvikling. For manges vedkommende er det tvert imot.</p>
<p>Heldigvis har det i år vært få beskyldninger om at Molde bare er et kjøpelag. Riktig nok ville det vært vanskelig å oppnå en slik suksess (fire seriemesterskap de siste årene) uten pengene fra Røkke/Gjelsten, men det er noe annet som er viktig med Molde.</p>
<p>Svein Ove Ekornesvåg, NTB scanpix</p>
<p>Svein Ove Ekornesvåg, NTB scanpix</p>
<p>Holdningene, meningen med å spille fotball, viljen til å utvikle et angrepsspill som kan føre til noe større, forståelsen av at et fotballag må bygges med kløkt og tålmodighet, utført av spillere med talent, teknikk og forståelse.</p>
<p>Alle har noe å lære av Molde. Rosenborg også (midlertidig, bare vent til neste år).</p></div>
<div type="title" level="3">Og så Glimt da</div>
<div type="text">
<p>Bodø/Glimt er det andre laget som kunne ha fått et fortjent-stempel på gullmedaljer denne sesongen. I likhet med Molde er Glimt et lag som står for noe, som i gode kamper viser noe som kan bringe norsk klubbfotball fremover, som stiller med personligheter som gjør at vi kan glede oss til kampene deres.</p>
<p>SETT DENNE? RBK-helten tordnet på direktesendt TV: – Det er det verste som kan skje med en fotballklubb. Det er undergangen.</p>
<p>Ole Martin Wold, NTB scanpix</p>
<p>Også noen andre har levert en sesong det står respekt av, som Odd, Viking, Kristiansund, Haugesund, Stabæk og Tromsø. På hver sin måte har disse lagene utnyttet sine muligheter, spilt fotball som gir mening og vært konsistente sesongen igjennom.</p>
<p>Ja, Tromsø også, selv om de fortsatt er i faresonen. TIL er klubben som trassig har holdt fast på at fotballspillet er noe mer enn å vinne dueller og få ballen vekk. Selv for en klubb med spinklere forutsetninger må det være mulig å utvikle et spill som ligner på moderne idrett, mener de tydeligvis. Derfor er det viktig at TIL holder seg.</p></div>
<div type="title" level="3">De står på</div>
<div type="text">
<p>Så var det resten da. Om disse åtte lagene kan vi brutalt si – om vi ser dem hver for seg – at de ikke ville vært savnet. Bare som gruppe og kampmotstandere.</p>
<p>Rosenborg, Brann, Vålerenga og Strømsgodset ville blitt etterlyst i kraft av at de er storklubber fra storbyer og derfor skaffer oppmerksomhet, ikke minst når de svikter. Men ikke engang Rosenborg, fortsatt i medaljekampen, har i år tilført noe fotballmessig som er verdt å ta vare på.</p>
<p>Marit Hommedal, NTB scanpix</p>
<p>De tre andre nevnte har ikke engang vært spesielt interessante som skuffelser.</p>
<p>Klubber som Lillestrøm, Mjøndalen, Ranheim og Sarpsborg 08 har bare listet seg gjennom serien – ingen tilførsel av ekstra oppmerksomhet før de nå i sluttkampene kjemper for å unngå nedrykk, ingen spillemessige bidrag. Det er mulig å mene at Mjøndalen og Ranheim fortjener å overleve i Eliteserien fordi de trosser sin egen ressursmangel, men mest derfor.</p></div>
<div type="title" level="3">Ikke til å unngå</div>
<div type="text">
<p>Summert er det slik at halvparten av lagene ikke har gitt positive sportslige bidrag i årets serie. Det er ødeleggende for de andre også.</p>
<p>Men må det ikke alltid være slik? Vi kan vel ikke vente at alle skal gå sammen i en felles dugnad for å løfte det tekniske nivået i serien, utvikle et gjennomført pasningsspill, slippe frem unge spillere med nye holdninger. Nei, men flere kanskje.</p>
<p>Jevne og spennende kamper har vi, det skorter ikke der. Men den spenningen er like stor foran TV. Den som skal sitte på tribunen, ønsker noe mer.</p>
<p>Selv lag nede på tabellen bør føle en forpliktelse til å løfte sitt spill, av respekt for både egne tilhengere og den ligaen de deltar i.</p></div></body></document>
