<?xml version="1.0" encoding="UTF-8"?>
<!DOCTYPE document SYSTEM "avis2.dtd" [<!ENTITY % HTMLsymbol SYSTEM "xhtml-symbol.ent"> %HTMLsymbol; ]>
<document>
<header>
<attribute name="file" value="DA-20191009-ny-rapport-snus-unde.xml"/>
<attribute name="url" value="http://www.dagsavisen.no/innenriks/ny-rapport-snus-under-svangerskapet-kan-pavirke-fosteret-negativt-1.1598359" frk="179 3 4 1210"/>
<attribute name="source" value="DA"/>
<attribute name="date" value="2019-10-09 20:46"/>
<attribute name="author" value="NTB"/>
<attribute name="gender" value="U"/>
<attribute name="class1" value="innenriks"/>
<attribute name="class2" value=""/>
<attribute name="language" value="nob"/>
</header>
<body>
<div type="title" level="1">Ny rapport: Snus under svangerskapet kan påvirke fosteret negativt</div>
<div type="ingress">Det er sannsynlig at risikoen for prematur fødsel øker dersom gravide bruker snus under svangerskapet, ifølge en ny rapport fra Folkehelseinstituttet.</div>
<div type="author"></div>
<div type="date"></div>
<div type="caption"></div>
<div type="text">
<p>Rapporten konkluderer med at det er mulig at gravide som snuser, øker risikoen for dødfødsel, keisersnitt, at den nyfødte har redusert kroppsvekst, får kortvarig pustestans, leppe- eller ganedefekter, og har økt mengde nedbrytningsprodukter av nikotin i urinen.</p>
<p>Knappe 20 prosent av norske menn og litt over 5 prosent av norske kvinner bruker snus daglig. Snusbruken i Norge har økt de siste tiårene, særlig blant unge voksne, og spesielt blant unge kvinner.</p></div>
<div type="title" level="3">Rapport</div>
<div type="text">
<p>Rapporten konkluderer også med at det er sannsynlig at snusbruk øker risikoen for kreft i spiserøret og bukspyttkjertelen, øker risikoen for diabetes type 2, og risikoen for å dø etter et hjerteinfarkt eller hjerneslag, samt høyner risikoen for metabolsk syndrom og høyt blodtrykk.</p>
<p>Snusrapporten er laget på oppdrag fra Helse- og omsorgsdepartementet. Den er basert gjennomgang av forskning på mennesker som bruker, snus sammenlignet med mennesker som ikke bruker snus, og flere andre typer studier. (NTB)</p></div></body></document>
