<?xml version="1.0" encoding="UTF-8"?>
<!DOCTYPE document SYSTEM "avis2.dtd" [<!ENTITY % HTMLsymbol SYSTEM "xhtml-symbol.ent"> %HTMLsymbol; ]>
<document>
<header>
<attribute name="file" value="AA-20191030-kontroversiell-yogab.xml"/>
<attribute name="url" value="http://www.adressa.no/100Sport/sprek/Kontroversiell-yogabok-skapte-stor-oppmerksomhet-For-Gunhild-43-ble-yoga-vendepunktet-280822b.html" frk="88 3 2 581 %%"/>
<attribute name="source" value="AA"/>
<attribute name="date" value="2019-10-30 19:16"/>
<attribute name="author" value=""/>
<attribute name="gender" value="U"/>
<attribute name="class1" value="sport,sprek"/>
<attribute name="class2" value=""/>
<attribute name="language" value="nob"/>
</header>
<body>
<div type="title" level="1">Kontroversiell yogabok skapte stor oppmerksomhet. For Gunhild (43) ble yoga vendepunktet.</div>
<div type="ingress">– Yoga reddet livet mitt, forteller Gunhild Merete Giil Desilets.</div>
<div type="author"></div>
<div type="date">30.10.2019 19:16</div>
<div type="caption"><p>– Pust inn kjærlighet og pust ut kjærlighet. Pust inn kjærlighet til deg, og pust ut kjærlighet til andre og din omverden, er et av yogauttrykkene Gunhild bruker under timene sine. Foto: ODD MEHUS</p></div>
<div type="text">
<p>Gunhild Merete Giil Desilets ønsker de oppmøtte deltagerne velkommen til dagens yogatime. De står oppstilt på hver sin turkise yogamatte, klar for å ta imot instrukser om hvilke yoga-positurer de skal utføre.</p></div></body></document>
