<?xml version="1.0" encoding="UTF-8"?>
<!DOCTYPE document SYSTEM "avis2.dtd" [<!ENTITY % HTMLsymbol SYSTEM "xhtml-symbol.ent"> %HTMLsymbol; ]>
<document>
<header>
<attribute name="file" value="DN-20190905-underleder-terningka.xml"/>
<attribute name="url" value="http://www.dn.no/underleder/underleder-terningkast/2-1-666681" frk="25 5 1 181 %%"/>
<attribute name="source" value="DN"/>
<attribute name="date" value="2019-09-05 17:52"/>
<attribute name="author" value="Leder DN"/>
<attribute name="gender" value="U"/>
<attribute name="class1" value="underleder"/>
<attribute name="class2" value="Meninger,Underleder"/>
<attribute name="language" value="nob"/>
</header>
<body>
<div type="title" level="1">Underleder: Terningkast</div>
<div type="ingress">KrF-leder Kjell Ingolf Ropstad får terningkast én av Dagbladet og terningkast fire av VG for innsatsen i TV 2s partilederdebatt i Bergen.</div>
<div type="author">Leder DN</div>
<div type="date">2019-09-05 17:52</div>
<div type="caption"></div>
<div type="text">
</div></body></document>
