<?xml version="1.0" encoding="UTF-8"?>
<!DOCTYPE document SYSTEM "avis2.dtd" [<!ENTITY % HTMLsymbol SYSTEM "xhtml-symbol.ent"> %HTMLsymbol; ]>
<document>
<header>
<attribute name="file" value="NL-20190722-bilhavari-pa-sandnes.xml"/>
<attribute name="url" value="http://www.nordlys.no/sandnessundbrua/tromso/trafikk/bilhavari-pa-sandnessundbrua/s/5-34-1166020" frk="86 7 4 557"/>
<attribute name="source" value="NL"/>
<attribute name="date" value="2019-07-22 15:58"/>
<attribute name="author" value="Magnus Aamo Holte"/>
<attribute name="gender" value="M"/>
<attribute name="class1" value=""/>
<attribute name="class2" value=""/>
<attribute name="language" value="nob"/>
</header>
<body>
<div type="title" level="1">Bilhavari på Sandnessundbrua</div>
<div type="ingress"></div>
<div type="author">Av Magnus Aamo Holte</div>
<div type="date">22. juli 2019, kl. 15:58</div>
<div type="caption"><p>DIRIGERER: Politiet rykket ut for å sørge for en smidig trafikkavvikling etter bilstansen på Sandnessundbrua rett før klokka 16 mandag. Foto: privat</p></div>
<div type="text">
<p>En bil har havarert på Sandnessundbrua rett før klokken 16 mandag ettermiddag.</p>
<p>- Bilen har kjørt i retning Tromsøya, og står på Kvaløyasiden. Vi rykker ut for å se til at trafikkavviklingen går så smidig som mulig i påvente av at bilen blir fjernet. Bilberger er på stedet, og trafikken bør snart gå som normalt i begge retninger, melder Troms politidistrikt.</p></div></body></document>
