<?xml version="1.0" encoding="UTF-8"?>
<!DOCTYPE document SYSTEM "avis2.dtd" [<!ENTITY % HTMLsymbol SYSTEM "xhtml-symbol.ent"> %HTMLsymbol; ]>
<document>
<header>
<attribute name="file" value="SA-20190219-forsker---barn-ma-la.xml"/>
<attribute name="url" value="http://www.aftenbladet.no/lokalt/i/bK0Va5/Forsker---Barn-ma-lare-seg-a-gjore-lekser-alene" frk="42 0 0 268 %%"/>
<attribute name="source" value="SA"/>
<attribute name="date" value="2019-02-19 14:48"/>
<attribute name="author" value=""/>
<attribute name="gender" value="U"/>
<attribute name="class1" value="lokalt"/>
<attribute name="class2" value="skole og utdanning,gjesdal kommune,skole"/>
<attribute name="language" value="nob"/>
</header>
<body>
<div type="title" level="1">Forsker: – Barn må lære seg å gjøre lekser alene</div>
<div type="ingress">Lekser gitt på riktig måte virker, mener forsker Thomas Nordahl.</div>
<div type="author"></div>
<div type="date"></div>
<div type="caption"><p>Leksene bør ikke være vanskeligere enn at eleven kan løse dem uten hjelp fra foreldrene, mener forsker Thomas Nordahl. Pål Christensen</p></div>
</body></document>
