<?xml version="1.0" encoding="UTF-8"?>
<!DOCTYPE document SYSTEM "avis2.dtd" [<!ENTITY % HTMLsymbol SYSTEM "xhtml-symbol.ent"> %HTMLsymbol; ]>
<document>
<header>
<attribute name="file" value="DA-20190221-city-snudde-til-seie.xml"/>
<attribute name="url" value="http://www.dagsavisen.no/sport/city-snudde-til-seier-med-ti-spillere-1.1281583" frk="55 17 6 351 %%"/>
<attribute name="source" value="DA"/>
<attribute name="date" value="2019-02-21 20:47"/>
<attribute name="author" value="NTB"/>
<attribute name="gender" value="U"/>
<attribute name="class1" value="sport"/>
<attribute name="class2" value=""/>
<attribute name="language" value="nob"/>
</header>
<body>
<div type="title" level="1">City snudde til seier med ti spillere</div>
<div type="ingress">FC Schalke - Manchester City 2-3). Manchester City ble redusert til ti mann på 1-2, men to sene scoringer fra Leroy Sané og Raheem Sterling ga de lyseblå 3-2 borte mot Schalke i mesterligaen.</div>
<div type="author"></div>
<div type="date"></div>
<div type="caption"><p>Manchester City tok med seg et godt utgangspunkt før returoppgjøret i åttedelsfinalen i mesterligaen.</p></div>
<div type="text">
</div></body></document>
