<?xml version="1.0" encoding="UTF-8"?>
<!DOCTYPE document SYSTEM "avis2.dtd" [<!ENTITY % HTMLsymbol SYSTEM "xhtml-symbol.ent"> %HTMLsymbol; ]>
<document>
<header>
<attribute name="file" value="DA-20190925-tidligere-danske-ban.xml"/>
<attribute name="url" value="http://www.dagsavisen.no/innenriks/tidligere-danske-bank-sjef-funnet-dod-i-estland-1.1590519" frk="114 27 20 735"/>
<attribute name="source" value="DA"/>
<attribute name="date" value="2019-09-25 20:46"/>
<attribute name="author" value="NTB"/>
<attribute name="gender" value="U"/>
<attribute name="class1" value="innenriks"/>
<attribute name="class2" value=""/>
<attribute name="language" value="nob"/>
</header>
<body>
<div type="title" level="1">Tidligere Danske Bank-sjef funnet død i Estland</div>
<div type="ingress">Den tidligere sjefen for Danske Banks avdeling i Estland, Aivar Rehe, er funnet død, opplyser estisk politi.</div>
<div type="author"></div>
<div type="date"></div>
<div type="caption"><p>Illustrasjonsfoto.</p></div>
<div type="text">
<p>56-åringen ble meldt savnet fra sitt hjem mandag og estisk politi har lett etter ham siden.</p>
<p>Aivar Rehe var sjef for Danske Banks estiske avdeling fra 2006 til 2015.</p>
<p>Den danske avisen Berlingske avslørte i 2017 at store beløp hadde passert gjennom den estiske banken uten at prosedyrer for å avsløre hvitvasking ble fulgt.</p>
<p>En intern gransking viste at det dreide seg om transaksjoner for nærmere 2.000 milliarder kroner, og en analyse utført av Jyske Bank konkluderte med at opptil 86 prosent av disse transaksjonene kunne være hvitvasking.</p></div></body></document>
