<?xml version="1.0" encoding="UTF-8"?>
<!DOCTYPE document SYSTEM "avis2.dtd" [<!ENTITY % HTMLsymbol SYSTEM "xhtml-symbol.ent"> %HTMLsymbol; ]>
<document>
<header>
<attribute name="file" value="VG-20190918-mdg-far-bydelsmakt-i.xml"/>
<attribute name="url" value="http://www.vg.no/nyheter/innenriks/i/lAX9pM/mdg-faar-bydelsmakt-i-oslo-og-ordfoereren-i-vardoe" frk="494 22 65 2868"/>
<attribute name="source" value="VG"/>
<attribute name="date" value="2019-09-18 19:07"/>
<attribute name="author" value=""/>
<attribute name="gender" value="U"/>
<attribute name="class1" value="nyheter,innenriks"/>
<attribute name="class2" value=""/>
<attribute name="language" value="nob"/>
</header>
<body>
<div type="title" level="1">MDG får bydelsmakt i Oslo og ordføreren i Vardø</div>
<div type="ingress">Miljøpartiet De Grønne er største parti i bydeler med tilsammen 200.000 innbyggere i Oslo. Det gir betydelig makt i bydelsutvalgene.</div>
<div type="author"></div>
<div type="date">Oppdatert nå nettopp</div>
<div type="caption"><p>JUBLER: MDGs frontfigur Lan Marie Nguyen Berg hadde grunn til å feire valgnatten. Onsdag ble det klart at miljøpartiet ble størst i fire bydelsutvalg i Oslo Foto: Annemor Larsen</p> <p>BLIR ORDFØRER: Ørjan Jensen blir ordfører i Vardø, som den første ordføreren fra MDG. Foto: MDG/Thomas Ekström</p></div>
<div type="text">
<p>I tillegg er miljøpartiet populært langt i nord, onsdag ble det nemlig kjent at de får sin aller første ordfører – i Vardø.</p>
<p>I Oslo er MDG størst i bydelsutvalgene Grünerløkka (26,4 prosent), St. Hanshaugen (26,2 prosent), Sagene (25,2 prosent og Gamle Oslo (22,3 prosent. Det viser ferske tall fra Oslo kommune. På St. Hanshaugen får partiet riktignok like mange representanter som Høyre, begge får fire.</p>
<p>les også</p></div>
<div type="title" level="3">Leder: Best uten Rødt</div>
<div type="title" level="3"> – Fantastisk motiverende</div>
<div type="text">
<p>I disse fire bydelene bor det rett under 200.000 mennesker eller nesten like mange som i Trondheim.</p>
<p>– Dette er fantastisk motiverende og veldig, veldig gøy at vi er det største partiet i fire bydelsutvalg, og da er det naturlig at vi får bydelslederen, sier Einar Wilhelmsen, leder av MDG i Oslo, til VG.</p>
<p>les også</p></div>
<div type="title" level="3">Valgforsker om bråket: En regjering i oppløsning</div>
<div type="text">
<p>Han forteller at de i år er representert i alle Oslos 15 bydelsutvalg, noe de ikke var for fire år siden. Bydelsutvalg er bydelens folkevalgte organ og består av 15 medlemmer med varamedlemmer. Bydelsutvalget har ansvar for desentraliserte kommunale oppgaver og fører tilsyn og kontroll med bydelsadministrasjonen.</p>
<p>Bydelsutvalget har blant annet ansvar for sykehjem, barnehager, barnevern og hjemmesykepleie.</p></div>
<div type="title" level="3">Forhandlinger</div>
<div type="text">
<p>– Mye av grunnen til at vi går så kraftig frem i bydelsvalget handler om at folk liker politikken vår og at de de vil ha mer, sier Wilhelmsen.</p>
<p>– Så hva skal dere gi dem?</p>
<p>– Nå skal vi jo gå inn og forhandle med Ap og SV, så det kan jeg ikke si så mye om annet enn at vi skal jobbe for å få realisert det vi har lovet, sier Wilhelmsen. Og legger til;</p>
<p>– Jeg tror mange har merket at med De Grønne har man fått renere luft og tryggere skoleveier og at vi gjør det mulig å sykle dit man vil om man er åtte eller 80 år.</p>
<p>MDG endte opp som Vardøs nest største parti. Partiet fikk 23,2 prosent av stemmene – en økning på hele 10,7 prosentpoeng fra forrige lokalvalg, skriver NRK.</p>
<p>Etter forhandlinger er Sp, Høyre, SV og MDG er enige om et samarbeid og ordførerkjedet går til MDG og Ørjan Jensen.</p>
<p>I Vardø gjorde også Senterpartiet et kjempevalg og endte opp med 20,6 prosent av stemmene, mens SV også styrket seg. I en koalisjon med Høyre danker de dermed ut Arbeiderpartiet, som gikk tilbake med 13,1 prosentpoeng til 40,5 prosent.</p>
<p>I bydel Gamle Oslo bor det 55 683 personer, på St Hanshaugen 38 400, på Grünerløkka 60 844 og Sagene 43 801.</p></div></body></document>
