<?xml version="1.0" encoding="UTF-8"?>
<!DOCTYPE document SYSTEM "avis2.dtd" [<!ENTITY % HTMLsymbol SYSTEM "xhtml-symbol.ent"> %HTMLsymbol; ]>
<document>
<header>
<attribute name="file" value="SA-20190114-forst-pisser-vi-pa-d.xml"/>
<attribute name="url" value="https://www.aftenbladet.no/meninger/kommentar/i/7lkjvW/Forst-pisser-vi-pa-dem_-og-sa-klager-vi-pa-at-de-lukter-vondt-Slik-graver-elitene-sin-egen-grav" frk="95 9 6 631 %%"/>
<attribute name="source" value="SA"/>
<attribute name="date" value="2019-01-14 12:05"/>
<attribute name="author" value=""/>
<attribute name="gender" value="U"/>
<attribute name="class1" value="meninger,kommentar"/>
<attribute name="class2" value="populisme,konspirasjonsteorier,samfunnsdebatt,falske nyheter,kommentator harald birkevold"/>
<attribute name="language" value="nob"/>
</header>
<body>
<div type="title" level="1">Først pisser vi på dem, og så klager vi på at de lukter vondt. Slik graver elitene sin egen grav</div>
<div type="ingress">KOMMENTAR: I den nye informasjonsalderen er det umulig å undertrykke alternative fortellinger. De må i stedet møtes med dannelse. Elitene graver sin egen grav ved å idioterklære dem som trues mest av globalisering og markedsliberale reformer.</div>
<div type="author"></div>
<div type="date"></div>
<div type="caption"><p>En kvinne sprayes ned med tåregass under en demonstrasjon i Paris 8. desember. Opptøyene mot president Emmanuel Macrons politikk stammer ikke fra blindt raseri og pøbelaktighet, men fra maktesløshet, skriver Aftenbladets kommentator Harald Birkevold. Yves Herman / X00380</p></div>
</body></document>
